{
  "$schema": "https://json-schema.org/draft/2020-12/schema",
  "$id": "https://ghostrace.local/schema/event-envelope-v1.json",
  "title": "GHOSTRACE event envelope v1",
  "x-ghostrace": { "schema_id": "ghostrace.event-envelope", "schema_version": 1, "compatibility": "strict", "unknown_fields": "reject" },
  "type": "object",
  "additionalProperties": false,
  "required": [
    "schema_version",
    "event_id",
    "observed_at",
    "ingested_at",
    "source",
    "kind",
    "payload",
    "collector_instance",
    "source_cursor",
    "provenance_version",
    "policy_profile_id",
    "policy_profile_version",
    "evidence",
    "parent_event_id"
  ],
  "properties": {
    "schema_version": { "const": 1 },
    "event_id": {
      "type": "string",
      "format": "uuid",
      "not": { "const": "00000000-0000-0000-0000-000000000000" }
    },
    "observed_at": { "type": "string", "format": "date-time" },
    "ingested_at": { "type": "string", "format": "date-time" },
    "source": { "$ref": "#/$defs/source" },
    "kind": { "$ref": "#/$defs/kind" },
    "payload": { "type": "object" },
    "collector_instance": { "$ref": "#/$defs/opaque_identifier" },
    "source_cursor": { "$ref": "#/$defs/nullable_cursor_id" },
    "provenance_version": { "$ref": "#/$defs/opaque_identifier" },
    "policy_profile_id": { "$ref": "#/$defs/opaque_identifier" },
    "policy_profile_version": { "type": "integer", "minimum": 1, "maximum": 4294967295 },
    "evidence": {
      "enum": ["direct", "contextual", "inferred", "unknown"]
    },
    "parent_event_id": {
      "oneOf": [
        {
          "type": "string",
          "format": "uuid",
          "not": { "const": "00000000-0000-0000-0000-000000000000" }
        },
        { "type": "null" }
      ]
    }
  },
  "allOf": [
    {
      "oneOf": [
        {
          "properties": {
            "source": { "const": "filesystem" },
            "kind": { "const": "filesystem_changed" },
            "payload": { "$ref": "#/$defs/filesystem_changed" }
          }
        },
        {
          "properties": {
            "source": { "const": "frontmost_app" },
            "kind": { "const": "frontmost_app_changed" },
            "payload": { "$ref": "#/$defs/frontmost_app_changed" }
          }
        },
        {
          "properties": {
            "source": { "const": "shell" },
            "kind": { "const": "shell_started" },
            "payload": { "$ref": "#/$defs/shell_started" }
          }
        },
        {
          "properties": {
            "source": { "const": "shell" },
            "kind": { "const": "shell_finished" },
            "payload": { "$ref": "#/$defs/shell_finished" }
          }
        },
        {
          "properties": {
            "source": { "const": "git" },
            "kind": { "const": "git_snapshot" },
            "payload": { "$ref": "#/$defs/git_snapshot" }
          }
        },
        {
          "properties": {
            "source": { "const": "browser" },
            "kind": { "const": "browser_navigation" },
            "payload": { "$ref": "#/$defs/browser_navigation" }
          }
        },
        {
          "properties": {
            "source": { "const": "browser" },
            "kind": { "const": "browser_bookmark_changed" },
            "payload": { "$ref": "#/$defs/browser_bookmark_changed" }
          }
        },
        {
          "properties": {
            "source": { "const": "lifecycle" },
            "kind": { "const": "collector_started" },
            "payload": { "$ref": "#/$defs/collector_started" }
          }
        },
        {
          "properties": {
            "source": { "const": "lifecycle" },
            "kind": { "const": "collector_stopped" },
            "payload": { "$ref": "#/$defs/collector_stopped" }
          }
        },
        {
          "properties": {
            "kind": { "const": "gap" },
            "payload": { "$ref": "#/$defs/gap" }
          }
        },
        {
          "properties": {
            "kind": { "const": "policy_blocked_summary" },
            "payload": { "$ref": "#/$defs/policy_blocked_summary" }
          }
        },
        {
          "properties": {
            "kind": { "const": "source_error" },
            "payload": { "$ref": "#/$defs/source_error" }
          }
        }
      ]
    },
    {
      "if": {
        "properties": {
          "kind": { "enum": ["gap", "policy_blocked_summary", "source_error"] }
        }
      },
      "then": {
        "oneOf": [
          {
            "properties": {
              "source": { "const": "filesystem" },
              "payload": {
                "properties": {
                  "data": { "properties": { "source": { "const": "filesystem" } } }
                }
              }
            }
          },
          {
            "properties": {
              "source": { "const": "frontmost_app" },
              "payload": {
                "properties": {
                  "data": { "properties": { "source": { "const": "frontmost_app" } } }
                }
              }
            }
          },
          {
            "properties": {
              "source": { "const": "shell" },
              "payload": {
                "properties": {
                  "data": { "properties": { "source": { "const": "shell" } } }
                }
              }
            }
          },
          {
            "properties": {
              "source": { "const": "git" },
              "payload": {
                "properties": {
                  "data": { "properties": { "source": { "const": "git" } } }
                }
              }
            }
          },
          {
            "properties": {
              "source": { "const": "browser" },
              "payload": {
                "properties": {
                  "data": { "properties": { "source": { "const": "browser" } } }
                }
              }
            }
          },
          {
            "properties": {
              "source": { "const": "lifecycle" },
              "payload": {
                "properties": {
                  "data": { "properties": { "source": { "const": "lifecycle" } } }
                }
              }
            }
          },
          {
            "properties": {
              "source": { "const": "fixture" },
              "payload": {
                "properties": {
                  "data": { "properties": { "source": { "const": "fixture" } } }
                }
              }
            }
          }
        ]
      }
    }
  ],
  "$defs": {
    "source": {
      "enum": [
        "filesystem",
        "frontmost_app",
        "shell",
        "git",
        "browser",
        "lifecycle",
        "fixture"
      ]
    },
    "kind": {
      "enum": [
        "filesystem_changed",
        "frontmost_app_changed",
        "shell_started",
        "shell_finished",
        "git_snapshot",
        "browser_navigation",
        "browser_bookmark_changed",
        "collector_started",
        "collector_stopped",
        "gap",
        "policy_blocked_summary",
        "source_error"
      ]
    },
    "opaque_identifier": {
      "type": "string",
      "minLength": 1,
      "maxLength": 128,
      "pattern": "^(?!.*\\.\\.)[a-z0-9](?:[a-z0-9._-]*[a-z0-9])?$"
    },
    "nullable_opaque_identifier": {
      "oneOf": [
        { "$ref": "#/$defs/opaque_identifier" },
        { "type": "null" }
      ]
    },
    "app_identifier": {
      "type": "string",
      "minLength": 1,
      "maxLength": 255,
      "pattern": "^(?!.*\\.\\.)[a-z0-9](?:[a-z0-9-]{0,61}[a-z0-9])?(?:\\.[a-z0-9](?:[a-z0-9-]{0,61}[a-z0-9])?)*$"
    },
    "nullable_app_identifier": {
      "oneOf": [
        { "$ref": "#/$defs/app_identifier" },
        { "type": "null" }
      ]
    },
    "branch_name": {
      "type": "string",
      "minLength": 1,
      "maxLength": 255,
      "pattern": "^(?![./])(?!.*(?:\\.\\.|//|@\\{|[\\\\:?*\\[\\]~^%]))(?!.*(?:^|/)\\.(?:/|$))(?!.*\\.lock$)[A-Za-z0-9](?:[A-Za-z0-9._/-]*[A-Za-z0-9])?$"
    },
    "sha256_digest": {
      "type": "string",
      "minLength": 71,
      "maxLength": 71,
      "pattern": "^sha256:[0-9a-f]{64}$"
    },
    "nullable_sha256_digest": {
      "oneOf": [
        { "$ref": "#/$defs/sha256_digest" },
        { "type": "null" }
      ]
    },
    "git_object_id": {
      "type": "string",
      "pattern": "^(?:[0-9a-f]{40}|[0-9a-f]{64})$"
    },
    "cursor_id": {
      "type": "string",
      "minLength": 1,
      "maxLength": 256,
      "pattern": "^(?!.*\\.\\.)[a-z0-9](?:[a-z0-9._-]*[a-z0-9])?$"
    },
    "nullable_cursor_id": {
      "oneOf": [
        { "$ref": "#/$defs/cursor_id" },
        { "type": "null" }
      ]
    },
    "reason_code": {
      "type": "string",
      "minLength": 1,
      "maxLength": 128,
      "pattern": "^[a-z][a-z0-9_]*$"
    },
    "filesystem_changed": {
      "type": "object",
      "additionalProperties": false,
      "required": ["type", "data"],
      "properties": {
        "type": { "const": "filesystem_changed" },
        "data": {
          "type": "object",
          "additionalProperties": false,
          "required": [
            "root_id",
            "path_class",
            "operation",
            "entry_kind",
            "path_digest",
            "size_bytes"
          ],
          "properties": {
            "root_id": { "$ref": "#/$defs/opaque_identifier" },
            "path_class": {
              "enum": ["workspace_relative", "home_relative", "absolute_redacted", "unknown"]
            },
            "operation": { "enum": ["created", "modified", "deleted", "renamed"] },
            "entry_kind": { "enum": ["file", "directory", "symlink", "unknown"] },
            "path_digest": { "$ref": "#/$defs/nullable_sha256_digest" },
            "size_bytes": {
              "oneOf": [
                { "type": "integer", "minimum": 0, "maximum": 18446744073709551615 },
                { "type": "null" }
              ]
            },
            "observation": {
              "enum": ["source_coalesced", "repeated_modification", "own_event"]
            },
            "rename_pairing": {
              "enum": ["unknown", "contextual"]
            }
          }
        }
      }
    },
    "frontmost_app_changed": {
      "type": "object",
      "additionalProperties": false,
      "required": ["type", "data"],
      "properties": {
        "type": { "const": "frontmost_app_changed" },
        "data": {
          "type": "object",
          "additionalProperties": false,
          "required": ["app_id", "change", "previous_app_id"],
          "properties": {
            "app_id": { "$ref": "#/$defs/app_identifier" },
            "change": { "enum": ["launched", "activated", "deactivated", "terminated"] },
            "previous_app_id": { "$ref": "#/$defs/nullable_app_identifier" }
          }
        }
      }
    },
    "shell_started": {
      "type": "object",
      "additionalProperties": false,
      "required": ["type", "data"],
      "properties": {
        "type": { "const": "shell_started" },
        "data": {
          "type": "object",
          "additionalProperties": false,
          "required": ["session_id", "shell_kind"],
          "properties": {
            "session_id": { "$ref": "#/$defs/opaque_identifier" },
            "shell_kind": { "$ref": "#/$defs/opaque_identifier" },
            "executable_id": {
              "$ref": "#/$defs/opaque_identifier",
              "not": { "pattern": "password|passwd|secret|credential|authorization|bearer|private-key" }
            },
            "working_directory": {
              "type": "object",
              "additionalProperties": false,
              "required": ["path_class", "path_digest"],
              "properties": {
                "path_class": {
                  "enum": ["workspace_relative", "home_relative", "absolute_redacted", "unknown"]
                },
                "path_digest": { "$ref": "#/$defs/sha256_digest" }
              }
            }
          }
        }
      }
    },
    "shell_finished": {
      "type": "object",
      "additionalProperties": false,
      "required": ["type", "data"],
      "properties": {
        "type": { "const": "shell_finished" },
        "data": {
          "type": "object",
          "additionalProperties": false,
          "required": ["session_id", "status", "exit_code", "duration_ms"],
          "properties": {
            "session_id": { "$ref": "#/$defs/opaque_identifier" },
            "status": { "enum": ["succeeded", "failed", "signaled", "unknown"] },
            "exit_code": {
              "oneOf": [
                { "type": "integer", "minimum": -2147483648, "maximum": 2147483647 },
                { "type": "null" }
              ]
            },
            "duration_ms": {
              "type": "integer",
              "minimum": 0,
              "maximum": 18446744073709551615
            },
            "signal": { "type": "integer", "minimum": 1, "maximum": 64 }
          }
        }
      }
    },
    "git_snapshot": {
      "type": "object",
      "additionalProperties": false,
      "required": ["type", "data"],
      "properties": {
        "type": { "const": "git_snapshot" },
        "data": {
          "type": "object",
          "additionalProperties": false,
          "required": [
            "repository_id",
            "branch",
            "head_oid",
            "dirty",
            "changed_file_count",
            "snapshot_digest"
          ],
          "properties": {
            "repository_id": { "$ref": "#/$defs/opaque_identifier" },
            "branch": { "$ref": "#/$defs/branch_name" },
            "head_oid": { "$ref": "#/$defs/git_object_id" },
            "dirty": { "type": "boolean" },
            "changed_file_count": {
              "type": "integer",
              "minimum": 0,
              "maximum": 18446744073709551615
            },
            "snapshot_digest": { "$ref": "#/$defs/nullable_sha256_digest" }
          }
        }
      }
    },
    "browser_navigation": {
      "type": "object",
      "additionalProperties": false,
      "required": ["type", "data"],
      "properties": {
        "type": { "const": "browser_navigation" },
        "data": {
          "type": "object",
          "additionalProperties": false,
          "required": ["browser", "url", "private_context"],
          "properties": {
            "browser": { "$ref": "#/$defs/opaque_identifier" },
            "url": {
              "type": "string",
              "minLength": 1,
              "maxLength": 8192,
              "format": "uri",
              "pattern": "^https?://[^/?#@\\s]+(?:/[^?#\\s]*)?$"
            },
            "private_context": { "const": false }
          }
        }
      }
    },
    "browser_bookmark_changed": {
      "type": "object",
      "additionalProperties": false,
      "required": ["type", "data"],
      "properties": {
        "type": { "const": "browser_bookmark_changed" },
        "data": {
          "type": "object",
          "additionalProperties": false,
          "required": ["browser", "bookmark_id", "change", "url", "folder_id", "private_context"],
          "properties": {
            "browser": { "$ref": "#/$defs/opaque_identifier" },
            "bookmark_id": { "$ref": "#/$defs/opaque_identifier" },
            "change": { "enum": ["created", "updated", "deleted"] },
            "url": {
              "type": "string",
              "minLength": 1,
              "maxLength": 8192,
              "format": "uri",
              "pattern": "^https?://[^/?#@\\s]+(?:/[^?#\\s]*)?$"
            },
            "folder_id": { "$ref": "#/$defs/nullable_opaque_identifier" },
            "private_context": { "const": false }
          }
        }
      }
    },
    "collector_lifecycle_data": {
      "type": "object",
      "additionalProperties": false,
      "required": ["collector", "instance_label"],
      "properties": {
        "collector": { "$ref": "#/$defs/source" },
        "instance_label": { "$ref": "#/$defs/opaque_identifier" }
      }
    },
    "collector_started": {
      "type": "object",
      "additionalProperties": false,
      "required": ["type", "data"],
      "properties": {
        "type": { "const": "collector_started" },
        "data": { "$ref": "#/$defs/collector_lifecycle_data" }
      }
    },
    "collector_stopped": {
      "type": "object",
      "additionalProperties": false,
      "required": ["type", "data"],
      "properties": {
        "type": { "const": "collector_stopped" },
        "data": { "$ref": "#/$defs/collector_lifecycle_data" }
      }
    },
    "gap": {
      "type": "object",
      "additionalProperties": false,
      "required": ["type", "data"],
      "properties": {
        "type": { "const": "gap" },
        "data": {
          "type": "object",
          "additionalProperties": false,
          "required": ["source", "reason_code", "dropped_count", "from_cursor", "to_cursor"],
          "properties": {
            "source": { "$ref": "#/$defs/source" },
            "reason_code": { "$ref": "#/$defs/reason_code" },
            "dropped_count": {
              "type": "integer",
              "minimum": 0,
              "maximum": 18446744073709551615
            },
            "from_cursor": { "$ref": "#/$defs/nullable_cursor_id" },
            "to_cursor": { "$ref": "#/$defs/nullable_cursor_id" },
            "volume_digest": {
              "oneOf": [
                { "$ref": "#/$defs/sha256_digest" },
                { "type": "null" }
              ]
            },
            "root_ids": {
              "type": "array",
              "items": { "$ref": "#/$defs/opaque_identifier" },
              "maxItems": 64
            },
            "remediation": {
              "oneOf": [
                {
                  "enum": [
                    "rescan_selected_roots",
                    "reconcile_selected_root",
                    "reinitialize_stream"
                  ]
                },
                { "type": "null" }
              ]
            }
          }
        }
      }
    },
    "policy_blocked_summary": {
      "type": "object",
      "additionalProperties": false,
      "required": ["type", "data"],
      "properties": {
        "type": { "const": "policy_blocked_summary" },
        "data": {
          "type": "object",
          "additionalProperties": false,
          "required": ["source", "reason_code", "count"],
          "properties": {
            "source": { "$ref": "#/$defs/source" },
            "reason_code": { "$ref": "#/$defs/reason_code" },
            "count": {
              "type": "integer",
              "minimum": 0,
              "maximum": 18446744073709551615
            }
          }
        }
      }
    },
    "source_error": {
      "type": "object",
      "additionalProperties": false,
      "required": ["type", "data"],
      "properties": {
        "type": { "const": "source_error" },
        "data": {
          "type": "object",
          "additionalProperties": false,
          "required": ["source", "reason_code", "retryable"],
          "properties": {
            "source": { "$ref": "#/$defs/source" },
            "reason_code": { "$ref": "#/$defs/reason_code" },
            "retryable": { "type": "boolean" }
          }
        }
      }
    }
  }
}
