{"schema_version":1,"event_id":"00000000-0000-4000-8000-000000000001","observed_at":"2026-01-01T00:00:00Z","ingested_at":"2026-01-01T00:00:00Z","source":"lifecycle","kind":"collector_started","payload":{"type":"collector_started","data":{"collector":"filesystem","instance_label":"fixture-fs-1"}},"collector_instance":"fixture-fs-1","source_cursor":"cursor-0001","provenance_version":"fixture-v1","policy_profile_id":"fixture-default-v1","policy_profile_version":1,"evidence":"direct","parent_event_id":null}
